#UC1::

mysql> create database AddressBookDB;
Query OK, 1 row affected (0.03 sec)

mysql> show databases;
+--------------------+
| Database           |
+--------------------+
| addressbookdb      |
| books              |
| employee           |
| employeedb         |
| erdb               |
| exam               |
| hr                 |
| information_schema |
| miniproject1       |
| mysql              |
| payroll_service    |
| performance_schema |
| sakila             |
| string             |
| sys                |
| world              |
+--------------------+
16 rows in set (0.00 sec)


#UC2::
mysql> use addressbookdb
Database changed
mysql> create table addressbook_table(firstname varchar(20),lastname varchar(20),address varchar(50),city varchar(20),state varchar(20),zip int,phone_number long,email varchar(30));
Query OK, 0 rows affected (0.06 sec)


#UC3::
mysql> insert into addressbook_table(firstname,lastname,address,city,state,zip,phone_number,email) values ('Pallavi','Jadhav','Wakad','Pune','Maharashtra',12345,9997895679,'pallavi08jadhav@gmail.com'),('Sunil','Kabadi','Baner','Pune','Maharashtra',45678,989898878,'sunil@gmail.com'),('Ajit','Jadhav','Dahigaon','Nagar','Maharashtra',478963,8888899999,'ajit@gmail.com'),('mansi','Singh','Basti','Basti','Uttarpradesh',85214,9999999888,'mansisingh@gmail.com');
Query OK, 4 rows affected (0.02 sec)
Records: 4  Duplicates: 0  Warnings: 0
mysql> select * from addressbook_table;
+-----------+----------+----------+-------+--------------+--------+--------------+---------------------------+
| firstname | lastname | address  | city  | state        | zip    | phone_number | email                     |
+-----------+----------+----------+-------+--------------+--------+--------------+---------------------------+
| Pallavi   | Jadhav   | Wakad    | Pune  | Maharashtra  |  12345 | 9997895679 | pallavi08jadhav@gmail.com |
| Sunil     | Kabadi   | Baner    | Pune  | Maharashtra  |  45678 | 989898878  | sunil@gmail.com           |
| Ajit      | Jadhav   | Dahigaon | Nagar | Maharashtra  | 478963 | 8888899999 | ajit@gmail.com            |
| mansi     | Singh    | Basti    | Basti | Uttarpradesh |  85214 | 9999999888 | mansisingh@gmail.com      |
+-----------+----------+----------+-------+--------------+--------+--------------+---------------------------+
4 rows in set (0.00 sec)

#UC4::

mysql>update addressbook_table set address='Wakad Bridge' where firstname = 'Pallavi';
Query OK, 1 row affected (0.01 sec)
Rows matched: 1  Changed: 1  Warnings: 0
mysql> select * from addressbook_table;
+-----------+----------+--------------+-------+--------------+--------+--------------+---------------------------+
| firstname | lastname | address      | city  | state        | zip    | phone_number | email                     |
+-----------+----------+--------------+-------+--------------+--------+--------------+---------------------------+
| Pallavi   | Jadhav   | Wakad Bridge | Pune  | Maharashtra  |  12345 | 9997895679   | pallavi08jadhav@gmail.com |
| Sunil     | Kabadi   | Baner        | Pune  | Maharashtra  |  45678 | 989898878    | sunil@gmail.com           |
| Ajit      | Jadhav   | Dahigaon     | Nagar | Maharashtra  | 478963 | 8888899999   | ajit@gmail.com            |
| mansi     | Singh    | Basti        | Basti | Uttarpradesh |  85214 | 9999999888   | mansisingh@gmail.com      |
+-----------+----------+--------------+-------+--------------+--------+--------------+---------------------------+
4 rows in set (0.00 sec)

#UC5::

mysql> delete from addressbook_table where firstname = 'Mansi';
Query OK, 1 row affected (0.04 sec)

mysql> select * from addressbook_table;
+-----------+----------+--------------+-------+-------------+--------+--------------+---------------------------+
| firstname | lastname | address      | city  | state       | zip    | phone_number | email                     |
+-----------+----------+--------------+-------+-------------+--------+--------------+---------------------------+
| Pallavi   | Jadhav   | Wakad Bridge | Pune  | Maharashtra |  12345 | 9997895679   | pallavi08jadhav@gmail.com |
| Sunil     | Kabadi   | Baner        | Pune  | Maharashtra |  45678 | 989898878    | sunil@gmail.com           |
| Ajit      | Jadhav   | Dahigaon     | Nagar | Maharashtra | 478963 | 8888899999   | ajit@gmail.com            |
+-----------+----------+--------------+-------+-------------+--------+--------------+---------------------------+
3 rows in set (0.00 sec)

#UC6:

mysql> select city,state from addressbook_table where firstname = 'Sunil';
+------+-------------+
| city | state       |
+------+-------------+
| Pune | Maharashtra |
+------+-------------+
1 row in set (0.00 sec)

#UC7::

mysql> select * from addressbook_table;
+-----------+----------+--------------+-------+-------------+--------+--------------+---------------------------+
| firstname | lastname | address      | city  | state       | zip    | phone_number | email                     |
+-----------+----------+--------------+-------+-------------+--------+--------------+---------------------------+
| Pallavi   | Jadhav   | Wakad Bridge | Pune  | Maharashtra |  12345 | 9997895679   | pallavi08jadhav@gmail.com |
| Sunil     | Kabadi   | Baner        | Pune  | Maharashtra |  45678 | 989898878    | sunil@gmail.com           |
| Ajit      | Jadhav   | Dahigaon     | Nagar | Maharashtra | 478963 | 8888899999   | ajit@gmail.com            |
+-----------+----------+--------------+-------+-------------+--------+--------------+---------------------------+
3 rows in set (0.00 sec)

mysql> select count(city),count(state) from addressbook_table where city = 'Pune
' and state = 'Maharashtra';
+-------------+--------------+
| count(city) | count(state) |
+-------------+--------------+
|           2 |            2 |
+-------------+--------------+
1 row in set (0.02 sec)

#UC8::

mysql> select firstname from addressbook_table where city = 'Pune' order by firs
tname ASC;
+-----------+
| firstname |
+-----------+
| Pallavi   |
| Sunil     |
+-----------+
2 rows in set (0.00 sec)

mysql>